{
  "schema_version": 2,
  "id": "expanded-editorial-density",
  "version": 1,
  "family": "editorial",
  "split": "development",
  "turns": [
    {
      "id": "t1",
      "prompt": "Make an original program cover for a riverside poetry reading, using the painting as a mood reference and the woven cloth as a rhythm reference. The words are River Voices, Saturday 16:00, North Quay Reading Room, and Poems, conversation, and a walk along the water. I want openness without the practical details looking lost. Show A with a broad quiet field and B with a more compressed column arrangement, at the same canvas size. The title should lead, followed by time and place, then the explanation. Translate the painting's large-versus-small movement into composition; do not paste or redraw the painting as a background. Keep the original reference-specific explanation separate from your design suggestions. Deliver a.svg, a.png, b.svg, b.png, thumb.svg, thumb.png, notes.md. Keep these filenames on every turn. PNG previews must use the declared dimensions; include actual rendered results, not an empty placeholder. PNG sizes: 160x160, 960x720.",
      "attachments": [
        "painting",
        "weave"
      ],
      "artifacts": [
        {
          "path": "a.svg",
          "kind": "editable",
          "format": "svg"
        },
        {
          "path": "a.png",
          "kind": "preview",
          "format": "png",
          "width": 960,
          "height": 720
        },
        {
          "path": "b.svg",
          "kind": "editable",
          "format": "svg"
        },
        {
          "path": "b.png",
          "kind": "preview",
          "format": "png",
          "width": 960,
          "height": 720
        },
        {
          "path": "thumb.svg",
          "kind": "editable",
          "format": "svg"
        },
        {
          "path": "thumb.png",
          "kind": "preview",
          "format": "png",
          "width": 160,
          "height": 160
        },
        {
          "path": "notes.md",
          "kind": "notes",
          "format": "md"
        }
      ]
    },
    {
      "id": "t2",
      "prompt": "Choose B for its alignment, not its density. Keep A unchanged. Add Admission free; step-free entrance on the east side and Bring a poem to share. I want the detail block easier to scan, with related information grouped by proximity and spacing rather than boxing every line. Preserve the title size and the accepted column edge. Deliver a.svg, a.png, b.svg, b.png, thumb.svg, thumb.png, notes.md. Keep these filenames on every turn. PNG previews must use the declared dimensions; include actual rendered results, not an empty placeholder. PNG sizes: 160x160, 960x720.",
      "attachments": [],
      "artifacts": [
        {
          "path": "a.svg",
          "kind": "editable",
          "format": "svg"
        },
        {
          "path": "a.png",
          "kind": "preview",
          "format": "png",
          "width": 960,
          "height": 720
        },
        {
          "path": "b.svg",
          "kind": "editable",
          "format": "svg"
        },
        {
          "path": "b.png",
          "kind": "preview",
          "format": "png",
          "width": 960,
          "height": 720
        },
        {
          "path": "thumb.svg",
          "kind": "editable",
          "format": "svg"
        },
        {
          "path": "thumb.png",
          "kind": "preview",
          "format": "png",
          "width": 160,
          "height": 160
        },
        {
          "path": "notes.md",
          "kind": "notes",
          "format": "md"
        }
      ]
    },
    {
      "id": "t3",
      "prompt": "Now check the design as a 160x160 social preview. The title must still be recognizable and the date/location group must remain distinct, even if the smallest invitation sentence is not fully readable. Change B's contrast and spacing only, keeping its text, title size, and column edge. Deliver the full-sized A/B sheets and the new thumbnail, and state which small text was actually legible. Deliver a.svg, a.png, b.svg, b.png, thumb.svg, thumb.png, notes.md. Keep these filenames on every turn. PNG previews must use the declared dimensions; include actual rendered results, not an empty placeholder. PNG sizes: 160x160, 960x720.",
      "attachments": [],
      "artifacts": [
        {
          "path": "a.svg",
          "kind": "editable",
          "format": "svg"
        },
        {
          "path": "a.png",
          "kind": "preview",
          "format": "png",
          "width": 960,
          "height": 720
        },
        {
          "path": "b.svg",
          "kind": "editable",
          "format": "svg"
        },
        {
          "path": "b.png",
          "kind": "preview",
          "format": "png",
          "width": 960,
          "height": 720
        },
        {
          "path": "thumb.svg",
          "kind": "editable",
          "format": "svg"
        },
        {
          "path": "thumb.png",
          "kind": "preview",
          "format": "png",
          "width": 160,
          "height": 160
        },
        {
          "path": "notes.md",
          "kind": "notes",
          "format": "md"
        }
      ]
    }
  ],
  "assets": [
    {
      "id": "painting",
      "path": "../../assets/met-436535.jpg",
      "sha256": "af0e3486621c210b54932d055294051b5601aa3362af4b84ab97e2831f8163bc",
      "license": "CC0 / Met Open Access",
      "source": "https://www.metmuseum.org/art/collection/search/436535",
      "visibility": "public"
    },
    {
      "id": "weave",
      "path": "../../assets/met-45406.jpg",
      "sha256": "24fcad8ac8807557be50fff389b5326ae29b561dcbe5e26f3dab17f1c45ed916",
      "license": "CC0 / Met Open Access",
      "source": "https://www.metmuseum.org/art/collection/search/45406",
      "visibility": "public"
    }
  ],
  "requirements": [
    {
      "id": "open",
      "turn": 1,
      "quote": "openness without the practical details looking lost"
    },
    {
      "id": "options",
      "turn": 1,
      "quote": "A with a broad quiet field and B with a more compressed column arrangement"
    },
    {
      "id": "hierarchy",
      "turn": 1,
      "quote": "The title should lead, followed by time and place, then the explanation."
    },
    {
      "id": "transfer",
      "turn": 1,
      "quote": "Translate the painting's large-versus-small movement into composition; do not paste or redraw the painting as a background."
    },
    {
      "id": "claims",
      "turn": 1,
      "quote": "Keep the original reference-specific explanation separate from your design suggestions."
    },
    {
      "id": "scope",
      "turn": 2,
      "quote": "Keep A unchanged."
    },
    {
      "id": "grouping",
      "turn": 2,
      "quote": "related information grouped by proximity and spacing rather than boxing every line"
    },
    {
      "id": "preserve",
      "turn": 2,
      "quote": "Preserve the title size and the accepted column edge."
    },
    {
      "id": "thumb",
      "turn": 3,
      "quote": "The title must still be recognizable and the date/location group must remain distinct"
    },
    {
      "id": "local",
      "turn": 3,
      "quote": "Change B's contrast and spacing only, keeping its text, title size, and column edge."
    }
  ],
  "atoms": [
    {
      "id": "field-with-legibility",
      "dimension": "composition",
      "criterion": "Open space frames rather than disconnects practical information.",
      "requirement_ids": [
        "open"
      ],
      "active_turns": [
        1,
        2,
        3
      ],
      "depends_on": [],
      "anchors": {
        "0": "The required relation is absent or contradicted by the declared evidence.",
        "1": "The relation is present in only some relevant views or states, or a visible exception remains.",
        "2": "The relation is visible and consistent across the requested views or states."
      },
      "evidence": {
        "kind": "visual",
        "required_artifacts": [
          "a.png",
          "b.png"
        ]
      }
    },
    {
      "id": "structural-alternatives",
      "dimension": "alternatives",
      "criterion": "A and B visibly use the requested different field/column organizations.",
      "requirement_ids": [
        "options"
      ],
      "active_turns": [
        1,
        2,
        3
      ],
      "depends_on": [],
      "anchors": {
        "0": "The required relation is absent or contradicted by the declared evidence.",
        "1": "The relation is present in only some relevant views or states, or a visible exception remains.",
        "2": "The relation is visible and consistent across the requested views or states."
      },
      "evidence": {
        "kind": "visual",
        "required_artifacts": [
          "a.png",
          "b.png"
        ]
      }
    },
    {
      "id": "reading-hierarchy",
      "dimension": "hierarchy",
      "criterion": "Title, time/place, and explanation have a clear reading order.",
      "requirement_ids": [
        "hierarchy"
      ],
      "active_turns": [
        1,
        2,
        3
      ],
      "depends_on": [],
      "anchors": {
        "0": "The required relation is absent or contradicted by the declared evidence.",
        "1": "The relation is present in only some relevant views or states, or a visible exception remains.",
        "2": "The relation is visible and consistent across the requested views or states."
      },
      "evidence": {
        "kind": "visual",
        "required_artifacts": [
          "a.png",
          "b.png"
        ]
      }
    },
    {
      "id": "nonliteral-transfer",
      "dimension": "reference_transfer",
      "criterion": "Reference movement is transformed into layout relations rather than pasted imagery.",
      "requirement_ids": [
        "transfer"
      ],
      "active_turns": [
        1,
        2,